sanskrit,hindi
श्रुत्वा त्रिशिरसो वाक्यं देवान्तकनरान्तकौ। अतिकायश्च तेजस्वी बभूवुर्युद्धहर्षिताः॥९॥,"त्रिशिरा का उपर्युक्त कथन सुनकर देवान्तक, नरान्तक और तेजस्वी अतिकाय—ये तीनों युद्ध के लिये उत्साहित हो गये॥९॥"
ततोऽहमहमित्येवं गर्जन्तो नैर्ऋतर्षभाः। रावणस्य सुता वीराः शक्रतुल्यपराक्रमाः॥१०॥,"‘मैं युद्ध के लिये जाऊँगा, मैं जाऊँगा’ ऐसा कहते और गर्जते हुए वे तीनों श्रेष्ठ निशाचर युद्ध के लिये तैयार हो गये। रावण के वे वीर पुत्र इन्द्र के समान पराक्रमी थे॥"
अन्तरिक्षगताः सर्वे सर्वे मायाविशारदाः। सर्वे त्रिदशदर्पघ्नाः सर्वे समरदुर्मदाः॥११॥,"वे सब-के-सब आकाश में विचरण करने वाले, मायाविशारद, रणदुर्मद तथा देवताओं का भी दर्प दलन करने वाले थे॥ ११॥"
सर्वे सुबलसम्पन्नाः सर्वे विस्तीर्णकीर्तयः। सर्वे समरमासाद्य न श्रूयन्ते स्म निर्जिताः॥१२॥ देवैरपि सगन्धर्वैः सकिंनरमहोरगैः। सर्वेऽस्त्रविदुषो वीराः सर्वे युद्धविशारदाः। सर्वे प्रवरविज्ञानाः सर्वे लब्धवरास्तथा॥१३॥,"वे सभी उत्तम बल से सम्पन्न थे। उन सबकी कीर्ति तीनों लोकों में फैली हुई थी और समरभूमि में आने पर गन्धर्वो, किन्नरों तथा बड़े-बड़े नागोंसहित देवताओं से भी कभी उन सबकी पराजय नहीं सुनी गयी थी। वे सभी अस्त्रवेत्ता, सभी वीर और सभी युद्ध की कला में निपुण थे। उन सबको शस्त्रों और शास्त्रों का उत्तम ज्ञान प्राप्त था और सबने तपस्या के द्वारा वरदान प्राप्त किया था॥ १२-१३॥"
स तैस्तथा भास्करतुल्यवर्चसैः सुतैर्वृतः शत्रुबलश्रियार्दनैः। रराज राजा मघवान् यथामरै तो महादानवदर्पनाशनैः॥१४॥,सूर्य के समान तेजस्वी तथा शत्रुओं की सेना और सम्पत्ति को रौंद डालने वाले उन पुत्रों से घिरा हुआ राक्षसों का राजा रावण बड़े-बड़े दानवों का दर्प चूर्ण करने वाले देवताओं से घिरे हुए इन्द्र की भाँति शोभा पा रहा था।
स पुत्रान् सम्परिष्वज्य भूषयित्वा च भूषणैः। आशीर्भिश्च प्रशस्ताभिः प्रेषयामास वै रणे॥१५॥,उसने अपने पुत्रों को हृदय से लगाकर नाना प्रकार के आभूषणों से विभूषित किया और उत्तम आशीर्वाद देकर रणभूमि में भेजा ॥ १५ ॥
युद्धोन्मत्तं च मत्तं च भ्रातरौ चापि रावणः। रक्षणार्थं कुमाराणां प्रेषयामास संयुगे॥१६॥,रावण ने अपने दोनों भाई युद्धोन्मत्त (महापार्श्व) और मत्त (महोदर)-को भी युद्ध में कुमारों की रक्षा के लिये भेजा॥१६॥
तेऽभिवाद्य महात्मानं रावणं लोकरावणम्। कृत्वा प्रदक्षिणं चैव महाकायाः प्रतस्थिरे॥१७॥,वे सभी महाकाय राक्षस समस्त लोकों को रुलाने वाले महामना रावण को प्रणाम और उसकी परिक्रमा करके युद्ध के लिये प्रस्थित हुए॥ १७ ॥
सर्वोषधीभिर्गन्धैश्च समालभ्य महाबलाः। निर्जग्मुर्नैर्ऋतश्रेष्ठाः षडेते युद्धकाक्षिणः॥१८॥ त्रिशिराश्चातिकायश्च देवान्तकनरान्तकौ। महोदरमहापाश्वौं निर्जग्मुः कालचोदिताः॥१९॥,"सब प्रकार की ओषधियों तथा गन्धों का स्पर्श करके युद्ध की अभिलाषा रखने वाले त्रिशिरा, अतिकाय, देवान्तक, नरान्तक, महोदर और महापार्श्व—ये छः महाबली श्रेष्ठ निशाचर काल से प्रेरित हो युद्ध के लिये पुरी से बाहर निकले ॥ १९॥"
ततः सुदर्शनं नागं नीलजीमूतसंनिभम्। ऐरावतकुले जातमारुरोह महोदरः॥२०॥,उस समय महोदर ऐरावत के कुल में उत्पन्न हुए काले मेघ के समान रंगवाले ‘सुदर्शन’ नामक हाथी पर सवार हुआ॥२०॥
सर्वायुधसमायुक्तस्तूणीभिश्चाप्यलंकृतः। रराज गजमास्थाय सवितेवास्तमूर्धनि॥२१॥,समस्त आयुधों से सम्पन्न और तूणीरों से अलंकृत महोदर उस हाथी की पीठ पर बैठकर अस्ताचल के शिखर पर विराजमान सूर्यदेव के समान शोभा पा रहा था॥ २१॥
हयोत्तमसमायुक्तं सर्वायुधसमाकुलम्। आरुरोह रथश्रेष्ठं त्रिशिरा रावणात्मजः॥२२॥,"रावणकुमार त्रिशिरा एक उत्तम रथ पर आरूढ़ हुआ, जिसमें सब प्रकार के अस्त्र-शस्त्र रखे गये थे और उत्तम घोड़े जुते हुए थे॥ २२ ॥"
त्रिशिरा रथमास्थाय विरराज धनुर्धरः। सविधुदुल्कः सज्वालः सेन्द्रचाप इवाम्बुदः॥२३॥,"उस रथ में बैठकर धनुष धारण किये त्रिशिरा विद्युत् , उल्का, ज्वाला और इन्द्रधनुष से युक्त मेघ के समान शोभा पाने लगा॥ २३॥"
त्रिभिः किरीटैस्त्रिशिराः शुशुभे स रथोत्तमे। हिमवानिव शैलेन्द्रस्त्रिभिः काञ्चनपर्वतैः॥ २४॥,उस उत्तम रथ में सवार हो तीन किरीटों से युक्त त्रिशिरा तीन सुवर्णमय शिखरों से युक्त गिरिराज हिमालय के समान शोभा पा रहा था॥ २४ ॥
अतिकायोऽतितेजस्वी राक्षसेन्द्रसुतस्तदा। आरुरोह रथश्रेष्ठं श्रेष्ठः सर्वधनुष्मताम्॥२५॥,राक्षसराज रावण का अत्यन्त तेजस्वी पुत्र अतिकाय समस्त धनुर्धारियों में श्रेष्ठ था। वह भी उस समय एक उत्तम रथ पर आरूढ़ हुआ॥ २५ ॥
सुचक्राक्षं सुसंयुक्तं स्वनुकर्षं सुकूबरम्। तूणीबाणासनैर्दीप्तं प्रासासिपरिघाकुलम्॥२६॥,"उस रथ के पहिये और धुरे बहुत सुन्दर थे। उसमें उत्तम घोड़े जुते हुए थे तथा उसके अनुकर्ष और कूबर भी सुदृढ़ थे। तूणीर, बाण और धनुष के कारण वह रथ उद्दीप्त हो रहा था। प्रास, खड्ग और परिघों से वह भरा हुआ था॥ २६॥"
"<p>१. रथ के धुरेपर कूबर के आधाररूप से स्थापित काष्ठविशेष को अनुकर्ष कहते हैं। २. कूबर उस काष्ठ को कहते हैं, जिसपर जुआ रखा जाता है। गाडी के हरसों को भी प्राचीनकाल में कूबर कहा जाता था।",स काञ्चनविचित्रेण किरीटेन विराजता। भूषणैश्च बभौ मेरुः प्रभाभिरिव भासयन्॥२७॥
वह सुवर्णनिर्मित विचित्र एवं दीप्तिशाली किरीट तथा अन्य आभूषणों से विभूषित हो अपनी प्रभा से प्रकाश का विस्तार करते हुए मेरुपर्वत के समान सुशोभित होता था॥ २७॥,स रराज रथे तस्मिन् राजसूनुर्महाबलः। वृतो नैर्ऋतशार्दूलैर्वज्रपाणिरिवामरैः॥२८॥
उस रथपर श्रेष्ठ निशाचरों से घिरकर बैठा हुआ वह महाबली राक्षस राजकुमार देवताओं से घिरे हुए वज्रपाणि इन्द्र के समान शोभा पाता था॥ २८॥,हयमुच्चैःश्रवःप्रख्यं श्वेतं कनकभूषणम्। मनोजवं महाकायमारुरोह नरान्तकः॥२९॥
नरान्तक उच्चैःश्रवा के समान श्वेत वर्णवाले एक सुवर्णभूषित विशालकाय और मन के समान वेगशाली अश्व पर आरूढ़ हुआ॥ २९॥,गृहीत्वा प्रासमुल्काभं विरराज नरान्तकः। शक्तिमादाय तेजस्वी गुहः शिखिगतो यथा॥३०॥
उल्का के समान दीप्तिमान् प्रास हाथ में लेकर तेजस्वी नरान्तक शक्ति लिये मोर पर बैठे हुए तेजःपुञ्ज से सम्पन्न कुमार कार्तिकेय के समान सुशोभित हो रहा था॥३०॥,देवान्तकः समादाय परिघं हेमभूषणम्। परिगृह्य गिरिं दोर्थ्यां वपुर्विष्णोर्विडम्बयन्॥३१॥
देवान्तक स्वर्णभूषित परिघ लेकर समुद्रमन्थन के समय दोनों हाथों से मन्दराचल उठाये हुए भगवान्विष्णु के स्वरूपका अनुकरण-सा कर रहा था॥ ३१॥,महापावो महातेजा गदामादाय वीर्यवान्। विरराज गदापाणिः कुबेर इव संयुगे॥३२॥
महातेजस्वी और पराक्रमी महापार्श्व हाथ में गदा लेकर युद्धस्थलमें गदाधारी कुबेर के समान शोभा पाने लगा॥,ते प्रतस्थुर्महात्मानोऽमरावत्याः सुरा इव। तान् गजैश्च तुरङ्गैश्च रथैश्चाम्बुदनिःस्वनैः॥३३॥ अनूत्पेतुर्महात्मानो राक्षसाः प्रवरायुधाः।
"अमरावतीपुरी से निकलने वाले देवताओं के समान वे सभी महाकाय निशाचर लङ्कापुरी से चले। उनके पीछे श्रेष्ठ आयुध धारण किये विशालकाय राक्षस हाथी, घोड़ों तथा मेघ की गर्जना के समान घर्घराहट पैदा करने वाले रथों पर सवार हो युद्ध के लिये निकले॥ ३३ १/२॥",ते विरेजुर्महात्मानः कुमाराः सूर्यवर्चसः॥३४॥ किरीटिनः श्रिया जुष्टा ग्रहा दीप्ता इवाम्बरे।
"वे सूर्यतुल्य तेजस्वी, महामनस्वी राक्षस राजकुमार मस्तक पर किरीट धारण करके उत्तम शोभा-सम्पत्ति से सेवित हो आकाश में प्रकाशित होने वाले ग्रहों के समान सुशोभित हो रहे थे॥३४ १/२॥",प्रगृहीता बभौ तेषां शस्त्राणामवलिः सिता॥३५॥ शरदभ्रप्रतीकाशा हंसावलिरिवाम्बरे।
उनके द्वारा धारण की हुई अस्त्र-शस्त्रों की श्वेत पंक्ति आकाश में शरद्ऋतु के बादलों की भाँति उज्ज्वल कान्ति से युक्त हंसों की श्रेणी के समान शोभा पा रही थी॥ ३५ १/२॥,मरणं वापि निश्चित्य शत्रूणां वा पराजयम्॥३६॥ इति कृत्वा मतिं वीराः संजग्मुः संयुगार्थिनः।
"आज या तो हम शत्रुओं को परास्त कर देंगे, या स्वयं ही मृत्यु की गोद में सदा के लिये सो जायेंगे ऐसा निश्चय करके वे वीर राक्षस युद्ध के लिये आगे बढ़े॥",जगर्जुश्च प्रणेदुश्च चिक्षिपुश्चापि सायकान्॥ ३७॥ जगृहुश्च महात्मानो निर्यान्तो युद्धदुर्मदाः।
"वे युद्धदुर्मद महामनस्वी निशाचर गर्जते, सिंहनाद करते, बाण हाथ में लेते और उन्हें शत्रुओं पर छोड़ देते थे॥",क्ष्वेडितास्फोटितानां वै संचचालेव मेदिनी॥ ३८॥ रक्षसां सिंहनादैश्च संस्फोटितमिवाम्बरम्।
"उन राक्षसों के गर्जने, ताल ठोंकने और सिंहनाद करने से पृथ्वी कम्पित-सी होने लगी और आकाश फटने-सा लगा॥ ३८ १/२॥",तेऽभिनिष्क्रम्य मुदिता राक्षसेन्द्रा महाबलाः॥ ददृशुर्वानरानीकं समुद्यतशिलानगम्।
"उन महाबली राक्षसशिरोमणि वीरों ने प्रसन्नतापूर्वक नगर की सीमा से बाहर निकलकर देखा, वानरों की सेना पर्वत-शिखर और बड़े-बड़े वृक्ष उठाये युद्ध के लिये तैयार खड़ी है॥ ३९ १/२ ॥",हरयोऽपि महात्मानो ददृशू राक्षसं बलम्॥४०॥ हस्त्यश्वरथसम्बाधं किङ्किणीशतनादितम्। नीलजीमूतसंकाशं समुद्यतमहायुधम्॥४१॥
"महामना वानरों ने भी राक्षससेना पर दृष्टिपात किया। वह हाथी, घोड़े और रथों से भरी थी, सैकड़ों-हजारों घुघुरुओं की रुनझुन से निनादित थी, काले मेघों की घटा-जैसी दिखायी देती थी और हाथों में बड़े-बड़े आयुध लिये हुए थी॥ ४०-४१॥",दीप्तानलरविप्रख्यैर्नैर्ऋतैः सर्वतो वृतम्। तद् दृष्ट्वा बलमायातं लब्धलक्षाः प्लवङ्गमाः॥४२॥ समुद्यतमहाशैलाः सम्प्रणेदुर्मुहुर्मुहुः। अमृष्यमाणा रक्षांसि प्रतिनर्दन्त वानराः॥४३॥
प्रज्वलित अग्नि और सूर्य के समान तेजस्वी राक्षसों ने उसे सब ओर से घेर रखा था। निशाचरों की उस सेना को आती देख वानर प्रहार करने का अवसर पाकर महान् पर्वतशिखर उठाये बारंबार गर्जना करने लगे। वे राक्षसों का सिंहनाद सहन न करने के कारण बदले में जोर-जोर से दहाड़ने लगे थे॥ ४२-४३॥,ततः समुत्कृष्टरवं निशम्य रक्षोगणा वानरयूथपानाम्। अमृष्यमाणाः परहर्षमुग्रं महाबला भीमतरं प्रणेदुः॥४४॥
वानरयूथपतियों का वह उच्च स्वर से किया हुआ गर्जन-तर्जन सुनकर भयंकर एवं महान् बल से सम्पन्न राक्षसगण शत्रुओं का हर्ष सहन न कर सके; अतः स्वयं भी अत्यन्त भीषण सिंहनाद करने लगे॥४४॥,ते राक्षसबलं घोरं प्रविश्य हरियूथपाः। विचेरुरुद्यतैः शैलैर्नगाः शिखरिणो यथा॥४५॥
तब वानर-यूथपति राक्षसों की उस भयंकर सेना में घुस गये और शैलशृङ्ग उठाये शिखरों वाले पर्वतों की भाँति वहाँ विचरण करने लगे॥ ४५ ॥,केचिदाकाशमाविश्य केचिदुर्व्या प्लवङ्गमाः। रक्षःसैन्येषु संक्रुद्धाः केचिद् द्रुमशिलायुधाः॥४६॥ द्रुमांश्च विपुलस्कन्धान् गृह्य वानरपुङ्गवाः।
वृक्षों और शिलाओं को आयुध के रूप में धारण किये वानर योद्धा राक्षस सैनिकों पर अत्यन्त कुपित हो आकाश में उड़-उड़कर विचरने लगे। कितने ही वानरशिरोमणि वीर मोटी-मोटी शाखाओं-वाले वृक्षों को हाथ में लेकर पृथ्वी पर विचरण करने लगे। ४६ १/२॥,तद् युद्धमभवद् घोरं रक्षोवानरसंकुलम्॥४७॥ ते पादपशिलाशैलैश्चक्रुर्वृष्टिमनूपमाम्। बाणौघैर्वार्यमाणाश्च हरयो भीमविक्रमाः॥४८॥
"उस समय राक्षसों और वानरों के उस युद्ध ने बड़ा भयंकर रूप धारण किया। राक्षसों ने बाणसमूहों की वर्षा द्वारा जब वानरों को आगे बढ़ने से रोका, उस समय वे भयंकर पराक्रमी वानर उन-पर वृक्षों, शिलाओं तथा शैल-शिखरों की अनुपम वृष्टि करने लगे॥ ४७-४८॥",सिंहनादान् विनेदुश्च रणे राक्षसवानराः। शिलाभिश्चूर्णयामासुर्यातुधानान् प्लवङ्गमाः॥४९॥ निर्जनुः संयुगे क्रुद्धाः कवचाभरणावृतान्।
राक्षस और वानर दोनों ही वहाँ रणक्षेत्र में सिंहों के समान दहाड़ रहे थे। कुपित हुए वानरों ने कवचों और आभूषणों से विभूषित बहुतेरे राक्षसों को युद्धस्थल में शिलाओं की मार से कुचल दिया—मार डाला॥ ४९ १/२॥,केचिद् रथगतान् वीरान् गजवाजिगतानपि॥५०॥ निर्जनुः सहसाऽऽप्लुत्य यातुधानान् प्लवङ्गमाः।
