sanskrit,hindi
Sarga Chapter- 2,Sarga Chapter- 2
॥ श्रीसीतारामचन्द्राभ्यां नमः॥ श्रीमद्वाल्मीकीय रामायण युद्धकाण्डम् द्वितीयः सर्गः (2),(सुग्रीव का श्रीराम को उत्साह प्रदान)
करना तं तु शोकपरिघुनं रामं दशरथात्मजम्। उवाच वचनं श्रीमान् सुग्रीवः शोकनाशनम्॥ १॥,इस प्रकार शोक से संतप्त हुए दशरथनन्दन श्रीराम से सुग्रीव ने उनके शोक का निवारण करने वाली बात कही— ॥१॥
किं त्वया तप्यते वीर यथान्यः प्राकृतस्तथा। मैवं भूस्त्यज संतापं कृतघ्न इव सौहृदम्॥२॥,"‘वीरवर! आप दूसरे साधारण मनुष्यों की भाँति क्यों संताप कर रहे हैं? आप इस तरह चिन्तित न हों। जैसे कृतघ्न पुरुष सौहार्द को त्याग देता है, उसी तरह आप भी इस संताप को छोड़ दें॥२॥"
संतापस्य च ते स्थानं नहि पश्यामि राघव। प्रवृत्तावुपलब्धायां ज्ञाते च निलये रिपोः॥३॥,"‘रघुनन्दन! जब सीता का समाचार मिल गया और शत्रु के निवास-स्थान का पता लग गया, तब मुझे आपके इस दुःख और चिन्ता का कोई कारण नहीं दिखायी देता॥३॥"
मतिमान् शास्त्रवित् प्राज्ञः पण्डितश्चासि राघव। त्यजेमां प्राकृतां बुद्धिं कृतात्मेवार्थदूषिणीम्॥४॥,"‘रघुकुलभूषण! आप बुद्धिमान्, शास्त्रों के ज्ञाता विचारकुशल और पण्डित हैं, अतः कृतात्मा पुरुष की भाँति इस अर्थदूषक प्राकृत बुद्धि का परित्याग कर दीजिये॥४॥"
समुद्रं लवयित्वा तु महानक्रसमाकुलम्। लङ्कामारोहयिष्यामो हनिष्यामश्च ते रिपुम्॥५॥,‘बड़े-बड़े नाकों से भरे हुए समुद्र को लाँघकर हम लोग लङ्का पर चढ़ाई करेंगे और आपके शत्रु को नष्ट कर डालेंगे॥५॥
निरुत्साहस्य दीनस्य शोकपर्याकुलात्मनः। सर्वार्था व्यवसीदन्ति व्यसनं चाधिगच्छति॥६॥,"‘जो पुरुष उत्साहशून्य, दीन और मन-ही-मन शोक से व्याकुल रहता है, उसके सारे काम बिगड़ जाते हैं और वह बड़ी विपत्ति में पड़ जाता है॥६॥"
इमे शूराः समर्थाश्च सर्वतो हरियूथपाः। त्वत्प्रियार्थं कृतोत्साहाः प्रवेष्टमपि पावकम्। एषां हर्षेण जानामि तर्कश्चापि दृढो मम॥७॥,‘ये वानरयूथपति सब प्रकार से समर्थ एवं शूरवीर हैं। आपका प्रिय करने के लिये इनके मन में बड़ा उत्साह है। ये आपके लिये जलती आग में भी प्रवेश कर सकते हैं। समुद्र को लाँघने और रावण को मारने का प्रसंग चलने पर इनका मुँह प्रसन्नता से खिल जाता है। इनके इस हर्ष और उत्साह से ही मैं इस बात को जानता हूँ तथा इस विषय में मेरा अपना तर्क (निश्चय) भी सुदृढ़ है॥७॥
विक्रमेण समानेष्ये सीतां हत्वा यथा रिपुम्। रावणं पापकर्माणं तथा त्वं कर्तुमर्हसि॥८॥,"‘आप ऐसा कीजिये, जिससे हमलोग पराक्रमपूर्वक अपने शत्रु पापाचारी रावण का वध करके सीता को यहाँ ले आवें॥ ८॥"
सेतुरत्र यथा बद्ध्येद् यथा पश्येम तां पुरीम्। तस्य राक्षसराजस्य तथा त्वं कुरु राघव॥९॥,"‘रघुनन्दन! आप ऐसा कोई उपाय कीजिये, जिससे समुद्र पर सेतु बँध सके और हम उस राक्षसराज की लङ्कापुरी को देख सकें॥९॥"
दृष्टा तां हि पुरीं लङ्गां त्रिकटशिखरे स्थिताम। हतं च रावणं युद्धे दर्शनादवधारय॥१०॥,‘त्रिकूटपर्वत के शिखर पर बसी हुई लङ्कापुरी एक बार दीख जाय तो आप यह निश्चित समझिये कि युद्ध में रावण दिखायी दिया और मारा गया॥ १० ॥
अबद्ध्वा सागरे सेतुं घोरे च वरुणालये। लङ्कां न मर्दितुं शक्या सेन्ट्रैरपि सुरासुरैः॥११॥,‘वरुण के निवासभूत घोर समुद्र पर पुल बाँधे बिना तो इन्द्रसहित सम्पूर्ण देवता और असुर भी लङ्का को पददलित नहीं कर सकते॥११॥
सेतुबन्धः समुद्रे च यावल्लङ्कासमीपतः। सर्वं तीर्णं च मे सैन्यं जितमित्युपधारय। इमे हि समरे वीरा हरयः कामरूपिणः॥१२॥,"‘अतः जब लङ्काके निकटतक समुद्रपर पुल बँध जायगा, तब हमारी सारी सेना उस पार चली जायगी। फिर तो आप यही समझिये कि अपनी जीत हो गयी; क्योंकि इच्छानुसार रूप धारण करने वाले ये वानर युद्ध में बड़ी वीरता दिखानेवाले हैं॥ १२॥"
तदलं विक्लवां बुद्धिं राजन् सर्वार्थनाशिनीम्। पुरुषस्य हि लोकेऽस्मिन् शोकः शौर्यापकर्षणः॥१३॥,‘अतः राजन्! आप इस व्याकुल बुद्धि का आश्रय न लें-बुद्धि की इस व्याकुलता को त्याग दें; क्योंकि यह समस्त कार्यों को बिगाड़ देने वाली है और शोक इस जगत् में पुरुष के शौर्य को नष्ट कर देता है॥ १३॥
यत् तु कार्यं मनुष्येण शौटीर्यमवलम्ब्यताम्। तदलंकरणायैव कर्तुर्भवति सत्वरम्॥१४॥,"‘मनुष्य को जिसका आश्रय लेना चाहिये, उस शौर्य का ही वह अवलम्बन करे; क्योंकि वह कर्ता को शीघ्र ही अलंकृत कर देता है उसके अभीष्ट फल की सिद्धि करा देता है॥ १४॥"
अस्मिन् काले महाप्राज्ञ सत्त्वमातिष्ठ तेजसा। शूराणां हि मनुष्याणां त्वद्विधानां महात्मनाम्। विनष्टे वा प्रणष्टे वा शोकः सर्वार्थनाशनः॥१५॥,"‘अतः महाप्राज्ञ श्रीराम! आप इस समय तेज के साथ ही धैर्य का आश्रय लें। कोई वस्तु खो गयी हो या नष्ट हो गयी हो, उसके लिये आप-जैसे शूरवीर महात्मा पुरुषों को शोक नहीं करना चाहिये; क्योंकि शोक सब कामों को बिगाड़ देता है॥ १५ ॥"
तत्त्वं बुद्धिमतां श्रेष्ठः सर्वशास्त्रार्थकोविदः। मद्विधैः सचिवैः सार्धमरिं जेतुं समर्हसि॥१६॥,‘आप बुद्धिमानों में श्रेष्ठ और सम्पूर्ण शास्त्रों के मर्मज्ञ हैं। अतः हम-जैसे मन्त्रियों एवं सहायकोंके साथ रहकर अवश्य ही शत्रु पर विजय प्राप्त कर सकते हैं॥ १६॥
नहि पश्याम्यहं कंचित् त्रिषु लोकेषु राघव। गृहीतधनुषो यस्ते तिष्ठेदभिमुखो रणे॥१७॥,"‘रघुनन्दन! मुझे तो तीनों लोकों में ऐसा कोई वीर नहीं दिखायी देता, जो रणभूमि में धनुष लेकर खड़े हुए आपके सामने ठहर सके॥१७॥"
वानरेषु समासक्तं न ते कार्यं विपत्स्यते। अचिराद् द्रक्ष्यसे सीतां तीसागरमक्षयम्॥१८॥,"‘वानरों पर जिसका भार रखा गया है, आपका वह कार्य बिगड़ने नहीं पायेगा। आप शीघ्र ही इस अक्षय समुद्र को पार करके सीता का दर्शन करेंगे॥ १८ ॥"
तदलं शोकमालम्ब्य क्रोधमालम्ब भूपते। निश्चेष्टाः क्षत्रिया मन्दाः सर्वे चण्डस्य बिभ्यति॥१९॥,"‘पृथ्वीनाथ! अपने हृदय में शोक को स्थान देना व्यर्थ है। इस समय तो आप शत्रुओं के प्रति क्रोध धारण कीजिये। जो क्षत्रिय मन्द (क्रोधशून्य) होते हैं, उनसे कोई चेष्टा नहीं बन पाती; परंतु जो शत्रु के प्रति आवश्यक रोष से भरा होता है, उससे सब डरते हैं। १९॥"
लङ्घनार्थं च घोरस्य समुद्रस्य नदीपतेः। सहास्माभिरिहोपेतः सूक्ष्मबुद्धिर्विचारय॥२०॥,"‘नदियों के स्वामी घोर समुद्र को पार करने के लिये क्या उपाय किया जाय, इस विषय में आप हमारे साथ बैठकर विचार कीजिये; क्योंकि आपकी बुद्धि बड़ी सूक्ष्म है॥ २०॥"
लक्षिते तत्र तैः सैन्यैर्जितमित्येव निश्चिनु। सर्वं तीर्णं च मे सैन्यं जितमित्यवधार्यताम्॥२१॥,‘यदि हमारे सैनिक समुद्र को लाँघ गये तो यही निश्चय रखिये कि अपनी जीत अवश्य होगी। सारी सेना का समुद्र के उस पार पहुँच जाना ही अपनी विजय समझिये॥२१॥
इमे हि हरयः शूराः समरे कामरूपिणः। तानरीन् विधमिष्यन्ति शिलापादपवृष्टिभिः॥२२॥,‘ये वानर संग्राम में बड़े शूरवीर हैं और इच्छानुसार रूप धारण कर सकते हैं। ये पत्थरों और पेड़ों की वर्षा करके ही उन शत्रुओं का संहार कर डालेंगे। २२॥
कथंचित् परिपश्यामि लङ्कितं वरुणालयम्। हतमित्येव तं मन्ये युद्धे शत्रुनिबर्हण॥२३॥,‘शत्रुसूदन श्रीराम! यदि किसी प्रकार मैं इस वानर-सेना को समुद्र के उस पार पहुँची देख सकूँ तो मैं रावण को युद्ध में मरा हुआ ही समझता हूँ॥२३॥
किमुक्त्वा बहुधा चापि सर्वथा विजयी भवान्। निमित्तानि च पश्यामि मनो मे सम्प्रहृष्यति॥२४॥,‘बहुत कहने से क्या लाभ! मेरा तो विश्वास है कि आप सर्वथा विजयी होंगे; क्योंकि मुझे ऐसे ही शकुन दिखायी देते हैं और मेरा हृदय भी हर्ष एवं उत्साह से भरा है’॥२४॥
इत्यार्षे श्रीमद्रामायणे वाल्मीकीये आदिकाव्ये युद्धकाण्डे द्वितीयः सर्गः॥२॥ इस प्रकार श्रीवाल्मीकि निर्मित आर्षरामायण आदिकाव्य के युद्धकाण्ड में दूसरा सर्ग पूरा हुआ॥२॥,  </main>
Sarga Chapter- 35,Sarga Chapter- 35
॥ श्रीसीतारामचन्द्राभ्यां नमः॥ श्रीमद्वाल्मीकीय रामायण युद्धकाण्डम् पञ्चत्रिंशः सर्गः (35),माल्यवान् का रावण को श्रीराम से संधि करने के लिये समझाना
तेन शङ्कविमिश्रेण भेरीशब्देन नादिना। उपयाति महाबाहू रामः परपुरंजयः॥१॥,शत्रुनगरी पर विजय पाने वाले महाबाहु श्रीराम ने शङ्खध्वनि से मिश्रित हो तुमुल नाद करने वाली भेरी की आवाज के साथ लङ्का पर आक्रमण किया॥१॥
तं निनादं निशम्याथ रावणो राक्षसेश्वरः। मुहूर्तं ध्यानमास्थाय सचिवानभ्युदैक्षत॥२॥,उस भेरीनाद को सुनकर राक्षसराज रावण ने दो घड़ी तक कुछ सोच-विचार करने के पश्चात् अपने मन्त्रियों की ओर देखा॥२॥
अथ तान् सचिवांस्तत्र सर्वानाभाष्य रावणः। सभां संनादयन् सर्वामित्युवाच महाबलः॥३॥ जगत्संतापनः क्रूरोऽगर्हयन् राक्षसेश्वरः।,"उन सब मन्त्रियों को सम्बोधित करके जगत् को संताप देने वाले, महाबली, क्रूर राक्षसराज रावण ने सारी सभा को प्रतिध्वनित करके किसी पर आक्षेप न करते हुए कहा- ॥ ३ १/२॥"
तरणं सागरस्यास्य विक्रमं बलपौरुषम्॥४॥ यदुक्तवन्तो रामस्य भवन्तस्तन्मया श्रुतम्। भवतश्चाप्यहं वेद्मि युद्धे सत्यपराक्रमान्। तूष्णीकानीक्षतोऽन्योन्यं विदित्वा रामविक्रमम्॥,"‘आपलोगों ने राम के पराक्रम, बल-पौरुष तथा समुद्र-लङ्घन की जो बात बतायी है, वह सब मैंने सुन ली; परंतु मैं तो आपलोगों को भी, जो इस समय राम के पराक्रम की बातें जानकर चुपचाप एकदूसरे का मुँह देख रहे हैं, संग्रामभूमि में सत्यपराक्रमी वीर समझता हूँ’॥ ४-५॥"
ततस्तु सुमहाप्राज्ञो माल्यवान् नाम राक्षसः। रावणस्य वचः श्रुत्वा इति मातामहोऽब्रवीत् ॥६॥,"रावण के इस आक्षेपपूर्ण वचन को सुनने के पश्चात् महाबुद्धिमान् माल्यवान् नामक राक्षस ने, जो रावण का नाना था, इस प्रकार कहा— ॥६॥"
विद्यास्वभिविनीतो यो राजा राजन् नयानुगः। स शास्ति चिरमैश्वर्यमरीश्च कुरुते वशे॥७॥,"‘राजन् ! जो राजा चौदहों विद्याओं में सुशिक्षित और नीति का अनुसरण करने वाला होता है, वह दीर्घकालतक राज्य का शासन करता है। वह शत्रुओं को भी वश में कर लेता है॥७॥"
संदधानो हि कालेन विगृह्णश्चारिभिः सह। स्वपक्षे वर्धनं कुर्वन्महदैश्वर्यमश्नुते॥८॥,"‘जो समय के अनुसार आवश्यक होने पर शत्रुओं के साथ संधि और विग्रह करता है तथा अपने पक्ष की वृद्धि में लगा रहता है, वह महान् ऐश्वर्य का भागी होता है॥८॥"
हीयमानेन कर्तव्यो राज्ञा संधिः समेन च। न शत्रुमवमन्येत ज्यायान् कुर्वीत विग्रहम्॥९॥,"‘जिस राजा की शक्ति क्षीण हो रही हो अथवा जो शत्रु के समान ही शक्ति रखता हो, उससे संधि कर लेनी चाहिये। अपने से अधिक या समान शक्तिवाले शत्रु का कभी अपमान न करे। यदि स्वयं ही शक्ति में बढ़ा-चढ़ा हो, तभी शत्रु के साथ वह युद्ध ठाने॥९॥"
तन्मह्यं रोचते संधिः सह रामेण रावण। यदर्थमभियुक्तोऽसि सीता तस्मै प्रदीयताम्॥१०॥,"‘इसलिये रावण! मुझे तो श्रीराम के साथ संधि करना ही अच्छा लगता है। जिसके लिये तुम्हारे ऊपर आक्रमण हो रहा है, वह सीता तुम श्रीराम को लौटा दो॥"
तस्य देवर्षयः सर्वे गन्धर्वाश्च जयैषिणः। विरोधं मा गमस्तेन संधिस्ते तेन रोचताम्॥११॥,"‘देखो देवता, ऋषि और गन्धर्व सभी श्रीराम की विजय चाहते हैं, अतः तुम उनसे विरोध न करो। उनके साथ संधि कर लेने की ही इच्छा करो॥ ११॥"
असृजद् भगवान् पक्षौ दावेव हि पितामहः। सुराणामसुराणां च धर्माधर्मों तदाश्रयौ॥१२॥,‘भगवान् ब्रह्मा ने सुर और असुर दो ही पक्षों की सृष्टि की है। धर्म और अधर्म ही इनके आश्रय हैं।१२॥
धर्मो हि श्रूयते पक्ष अमराणां महात्मनाम्। अधर्मो रक्षसां पक्षो ह्यसुराणां च राक्षस॥१३॥,‘सुना जाता है महात्मा देवताओं का पक्ष धर्म है। राक्षसराज! राक्षसों और असुरों का पक्ष अधर्म है॥१३॥
धर्मो वै ग्रसतेऽधर्मं यदा कृतमभूद् युगम्। अधर्मो ग्रसते धर्मं यदा तिष्यः प्रवर्तते॥१४॥,"‘जब सत्ययुग होता है, तब धर्म बलवान् होकर अधर्म को ग्रस लेता है और जब कलियुग आता है, तब अधर्म ही धर्म को दबा देता है॥ १४॥"
तत् त्वया चरता लोकान् धर्मोऽपि निहतो महान्। अधर्मः प्रगृहीतश्च तेनास्मद् बलिनः परे॥१५॥,"‘तुमने दिग्विजय के लिये सब लोकों में भ्रमण करते हुए महान् धर्म का नाश किया है और अधर्म को गले लगाया है, इसलिये हमारे शत्रु हमसे प्रबल हैं।"
