sanskrit,hindi
विनेदुश्च महाघोषाः शङ्खाः शतसहस्रशः। राक्षसानां सुघोराणां मुखमारुतपूरिताः॥ ३५॥,साथ ही भयानक राक्षसों के मुख की वायु से पूरित हो लाखों गम्भीर घोषवाले शङ्ख बजने लगे॥ ३५॥
ते बभुः शुभनीलाङ्गाः सशङ्खा रजनीचराः। विद्युन्मण्डलसंनद्धाः सबलाका इवाम्बुदाः॥३६॥,आभूषणों की प्रभा से सुशोभित काले शरीर वाले वे निशाचर शङ्ख बजाते समय विद्युत्प्रभा से उद्भासिततथा वकपंक्तियों से युक्त नील मेघों के समान जान पड़ते थे॥
निष्पतन्ति ततः सैन्या हृष्टा रावणचोदिताः। समये पूर्यमाणस्य वेगा इव महोदधेः॥३७॥,"तदनन्तर रावण की प्रेरणा से उसके सैनिक बड़े हर्ष के साथ युद्ध के लिये निकलने लगे, मानो प्रलयकाल में महान् मेघों के जल से भरे जाते हुए समुद्र के वेग आगे बढ़ रहे हों॥३७॥"
ततो वानरसैन्येन मुक्तो नादः समन्ततः। मलयः परितो येन ससानप्रस्थकन्दरः॥३८॥,"तत्पश्चात् वानर सैनिकों ने सब ओर बड़े जोर से सिंहनाद किया, जिससे छोटे-बड़े शिखरों और कन्दराओंसहित मलयपर्वत गूंज उठा॥ ३८॥"
शङ्खदुन्दुभिनिर्घोषः सिंहनादस्तरस्विनाम्। पृथिवीं चान्तरिक्षं च सागरं चाभ्यनादयत्॥३९॥ गजानां बृंहितैः सार्धं हयानां हृषितैरपि। रथानां नेमिनिर्घोषै रक्षसां वदनस्वनैः॥४०॥,"इस प्रकार हाथियों के चिग्घाड़ने, घोड़ों के हिनहिनाने, रथों के पहियों की घर्घराहट एवं राक्षसों के मुख से प्रकट हुई आवाज के साथ ही शङ्ख और दुन्दुभियों के शब्द तथा वेगवान् वानरों के निनाद से पृथ्वी, आकाश और समुद्र निनादित हो उठे॥ ३९-४०॥"
एतस्मिन्नन्तरे घोरः संग्रामः समपद्यत। रक्षसां वानराणां च यथा देवासुरे पुरा॥४१॥,इतने ही में पूर्वकाल में घटित हुए देवासुर-संग्राम की भाँति राक्षसों और वानरों में घोर युद्ध होने लगा। ४१॥
ते गदाभिः प्रदीप्ताभिः शक्तिशूलपरश्वधैः। निजघ्नुर्वानरान् सर्वान् कथयन्तः स्वविक्रमान्॥४२॥,"वे राक्षस दमकती हुई गदाओं तथा शक्ति, शूल और फरसों से समस्त वानरों को मारने एवं अपने पराक्रम की घोषणा करने लगे॥ ४२॥"
तथा वृक्षैर्महाकायाः पर्वताग्रैश्च वानराः। निजघ्नुस्तानि रक्षांसि नखैर्दन्तैश्च वेगिनः॥४३॥,"उसी प्रकार वेगशाली विशालकाय वानर भी राक्षसों पर बड़े-बड़े वृक्षों, पर्वत-शिखरों, नखों और दाँतों से चोट करने लगे॥४३॥"
राजा जयति सुग्रीव इति शब्दो महानभूत्।४४॥,वानरसेना में ‘वानरराज सुग्रीव की जय हो’ यह महान् शब्द होने लगा। उधर राक्षसलोग भी ‘महाराज रावण की जय हो’ ऐसा कहकर अपने-अपने नाम का उल्लेख करने लगे॥४४॥
राक्षसास्त्वपरे भीमाः प्राकारस्था महीं गतान्। वानरान् भिन्दिपालैश्च शूलैश्चैव व्यदारयन्॥४५॥,"दूसरे बहुत-से भयानक राक्षस जो परकोटे पर चढ़े हुए थे, पृथ्वी पर खड़े हुए वानरों को भिन्दिपालों और शूलों से विदीर्ण करने लगे॥ ४५ ॥"
वानराश्चापि संक्रुद्धाः प्राकारस्थान् महीं गताः। राक्षसान् पातयामासुः खमाप्लुत्य स्वबाहुभिः॥४६॥,तब पृथ्वी पर खड़े हुए वानर भी अत्यन्त कुपित हो उठे और आकाश में उछलकर परकोटे पर बैठे हुए राक्षसों को अपनी बाँहों से पकड़-पकड़कर गिराने लगे॥
स सम्प्रहारस्तुमुलो मांसशोणितकर्दमः। रक्षसां वानराणां च सम्बभूवाद्भुतोपमः॥४७॥,"इस प्रकार राक्षसों और वानरों में बड़ा ही अद्भुत घमासान युद्ध हुआ, जिससे वहाँ रक्त और मांस की कीच जम गयी॥"
इत्यार्षे श्रीमद्रामायणे वाल्मीकीये आदिकाव्ये युद्धकाण्डे द्विचत्वारिंशः सर्गः॥४२॥ इस प्रकार श्रीवाल्मीकि निर्मित आर्षरामायण आदिकाव्य के युद्धकाण्ड में बयालीसवाँ सर्ग पूरा हुआ।४२॥,  </main>
Sarga Chapter- 62,Sarga Chapter- 62
॥ श्रीसीतारामचन्द्राभ्यां नमः॥ श्रीमद्वाल्मीकीय रामायण युद्धकाण्डम् द्विषष्टितमः सर्गः (62),कुम्भकर्ण का रावण के भवन में प्रवेश तथा रावण का राम से भय बताकर उसे शत्रुसेना के विनाश के लिये प्रेरित करना
स तु राक्षसशार्दूलो निद्रामदसमाकुलः। राजमार्गं श्रिया जुष्टं ययौ विपुलविक्रमः॥१॥,महापराक्रमी राक्षसशिरोमणि कुम्भकर्ण निद्रा और मद से व्याकुल हो अलसाया हुआ-सा शोभाशाली राजमार्ग से जा रहा था॥१॥
राक्षसानां सहस्रैश्च वृतः परमदुर्जयः। गृहेभ्यः पुष्पवर्षेण कीर्यमाणस्तदा ययौ॥२॥,"वह परम दुर्जय वीर हजारों राक्षसों से घिरा हुआ यात्रा कर रहा था। सड़क के किनारे पर जो मकान थे, उनमें से उसके ऊपर फूल बरसाये जा रहे थे॥२॥"
स हेमजालविततं भानुभास्वरदर्शनम्। ददर्श विपुलं रम्यं राक्षसेन्द्रनिवेशनम्॥३॥,"उसने राक्षसराज रावण के रमणीय एवं विशाल भवन का दर्शन किया, जो सोने की जाली से आच्छादित होने के कारण सूर्यदेव के समान दीप्तिमान् दिखायी देता था॥"
स तत्तदा सूर्य इवाभ्रजालं प्रविश्य रक्षोधिपतेर्निवेशनम्। ददर्श दूरेऽग्रजमासनस्थं स्वयंभुवं शक्र इवासनस्थम्॥४॥,"जैसे सूर्य मेघों की घटा में छिप जायँ, उसी प्रकार कुम्भकर्ण ने राक्षसराज के महल में प्रवेश किया और राजसिंहासन पर बैठे हुए अपने भाई को दूरसे ही देखा, मानो देवराज इन्द्र ने दिव्य कमलासन पर विराजमान स्वयम्भू ब्रह्मा का दर्शन किया हो॥४॥"
भ्रातुः स भवनं गच्छन् रक्षोगणसमन्वितः। कुम्भकर्णः पदन्यासैरकम्पयत मेदिनीम्॥५॥,"राक्षसोंसहित कुम्भकर्ण अपने भाई के भवन में जाते समय जब-जब एक-एक पैर आगे बढ़ाता था, तब-तब पृथ्वी काँप उठती थी॥ ५ ॥"
सोऽभिगम्य गृहं भ्रातुः कक्ष्यामभिविगाह्य च। ददर्शोद्विग्नमासीनं विमाने पुष्पके गुरुम्॥६॥,"भाई के भवन में जाकर जब वह भीतर की कक्षा में प्रविष्ट हुआ, तब उसने अपने बड़े भाई को उद्विग्न अवस्था में पुष्पक विमान पर विराजमान देखा॥६॥"
अथ दृष्ट्वा दशग्रीवः कुम्भकर्णमुपस्थितम्। तूर्णमुत्थाय संहृष्टः संनिकर्षमुपानयत्॥७॥,कुम्भकर्ण को उपस्थित देख दशमुख रावण तुरंत उठकर खड़ा हो गया और बड़े हर्ष के साथ उसे अपने समीप बुला लिया॥७॥
अथासीनस्य पर्यङ्के कुम्भकर्णो महाबलः। भ्रातुर्ववन्दे चरणौ किं कृत्यमिति चाब्रवीत्॥८॥,महाबली कुम्भकर्ण ने सिंहासन पर बैठे हुए अपने भाई के चरणों में प्रणाम किया और पूछा—’कौन-सा कार्य आ पड़ा है ?’॥ ८॥
उत्पत्य चैनं मुदितो रावणः परिषस्वजे। स भ्रात्रा सम्परिष्वक्तो यथावच्चाभिनन्दितः॥९॥,रावण ने उछलकर बड़ी प्रसन्नता के साथ कुम्भकर्ण को हृदय से लगा लिया। भाई रावण ने उसका आलिंगन करके यथावत् रूप से अभिनन्दन किया॥९॥
कुम्भकर्णः शुभं दिव्यं प्रतिपेदे वरासनम्। स तदासनमाश्रित्य कुम्भकर्णो महाबलः॥१०॥ संरक्तनयनः क्रोधाद् रावणं वाक्यमब्रवीत्।,इसके बाद कुम्भकर्ण सुन्दर दिव्य सिंहासन पर बैठा। उस आसन पर बैठकर महाबली कुम्भकर्ण ने क्रोध से लाल आँखें किये रावण से पूछा- ॥ १० १/२॥
किमर्थमहमादृत्य त्वया राजन् प्रबोधितः॥११॥ शंस कस्माद् भयं तेऽत्र को वा प्रेतो भविष्यति।,"‘राजन् ! किसलिये तुमने बड़े आदर के साथ मुझे जगाया है? बताओ, यहाँ तुम्हें किससे भय प्राप्त हुआ है? अथवा कौन परलोक का पथिक होने वाला है?’ ॥ ११ १/२॥"
भ्रातरं रावणः क्रुद्धं कुम्भकर्णमवस्थितम्॥१२॥ रोषेण परिवृत्ताभ्यां नेत्राभ्यां वाक्यमब्रवीत्।,तब रावण अपने पास बैठे हुए कुपित भाई कुम्भकर्ण से रोष से चञ्चल आँखें किये बोला—॥ १२ १/२॥
अद्य ते सुमहान् कालः शयानस्य महाबल॥१३॥ सुषुप्तस्त्वं न जानीषे मम रामकृतं भयम्।,‘महाबली वीर! तुम्हारे सोये-सोये दीर्घकाल व्यतीत हो गया। तुम गाढ़ निद्रा में निमग्न होने के कारण नहीं जानते कि मुझे राम से भय प्राप्त हुआ है। १३ १/२॥
एष दाशरथिः श्रीमान् सुग्रीवसहितो बली॥१४॥ समुद्रं लवयित्वा तु मूलं नः परिकृन्तति।,‘ये दशरथकुमार बलवान् श्रीमान् राम सुग्रीव के साथ समुद्र लाँघकर यहाँ आये हैं और हमारे कुल का विनाश कर रहे हैं॥ १४ १/२॥
हन्त पश्यस्व लङ्कायां वनान्युपवनानि च॥१५॥ सेतुना सुखमागत्य वानरैकार्णवं कृतम्।,"‘हाय! देखो तो सही, समुद्र में पुल बाँधकर सुखपूर्वक यहाँ आये हुए वानरों ने लङ्का के समस्त वनों और उपवनों को एकार्णवमय बना दिया है— यहाँ वानररूपी जल का समुद्र-सा लहरा रहा है॥ १५ १/२॥"
ये राक्षसा मुख्यतमा हतास्ते वानरैयुधि॥१६॥ वानराणां क्षयं युद्धे न पश्यामि कथंचन। न चापि वानरा युद्धे जितपूर्वाः कदाचन ॥१७॥,"‘हमारे जो मुख्य-मुख्य राक्षस वीर थे, उन्हें वानरों ने युद्ध में मार डाला; किंतु रणभूमि में वानरों का संहार होता मुझे किसी तरह नहीं दिखायी देता। युद्ध में कभी कोई वानर पहले जीते नहीं गये हैं॥ १६-१७॥"
तदेतद् भयमुत्पन्नं त्रायस्वेह महाबल। नाशय त्वमिमानद्य तदर्थं बोधितो भवान्॥१८॥,‘महाबली वीर! इस समय हमारे ऊपर यही भय उपस्थित हुआ है। तुम इससे हमारी रक्षा करो और आज इन वानरों को नष्ट कर दो। इसीलिये हमने तुम्हें जगाया है॥ १८॥
सर्वक्षपितकोशं च स त्वमभ्युपपद्य माम्। त्रायस्वेमां पुरीं लङ्कां बालवृद्धावशेषिताम्॥१९॥,‘हमारा सारा खजाना खाली हो गया है; अतः मुझपर अनुग्रह करके तुम इस लङ्कापुरी की रक्षा करो; अब यहाँ केवल बालक और वृद्ध ही शेष रह गये हैं॥ १९॥
भ्रातुरर्थे महाबाहो कुरु कर्म सुदुष्करम्। मयैवं नोक्तपूर्वो हि भ्राता कश्चित् परंतप॥२०॥,‘महाबाहो! तुम अपने इस भाई के लिये अत्यन्त दुष्कर पराक्रम करो। परंतप! आज से पहले कभी किसी भाई से मैंने ऐसी अनुनय-विनय नहीं की थी॥२०॥
त्वय्यस्ति मम च स्नेहः परा सम्भावना च मे। देवासुरेषु युद्धेषु बहुशो राक्षसर्षभ॥२१॥ त्वया देवाः प्रतिव्यूह्य निर्जिताश्चासुरा युधि॥२२॥,‘तुम्हारे ऊपर मेरा बड़ा स्नेह है और मुझे तुमसे बड़ी आशा है। राक्षसशिरोमणे! तुमने देवासुरसंग्राम के अवसरों पर अनेक बार प्रतिद्वन्द्वी का स्थान लेकर रणभूमि में देवताओं और असुरों को भी परास्त किया है।
तदेतत् सर्वमातिष्ठ वीर्यं भीमपराक्रम। नहि ते सर्वभूतेषु दृश्यते सदृशो बली॥ २३॥,‘अतः भयंकर पराक्रमी वीर! तुम्हीं यह सारा पराक्रमपूर्ण कार्य सम्पन्न करो; क्योंकि समस्त प्राणियों में तुम्हारे समान बलवान् मुझे दूसरा कोई नहीं दिखायी देता है॥२३॥
कुरुष्व मे प्रियहितमेतदुत्तमं यथाप्रियं प्रियरण बान्धवप्रिय। स्वतेजसा व्यथय सपत्नवाहिनीं शरद्धनं पवन इवोद्यतो महान्॥२४॥,"‘तुम युद्धप्रेमी तो हो ही, अपने बन्धु-बान्धवों से भी बड़ा प्रेम रखते हो। इस समय तुम मेरा यही प्रिय और उत्तम हित करो। अपने तेज से शत्रुओं की सेना को उसी तरह व्यथित कर दो, जैसे वेग से उठी हुई प्रचण्ड वायु शरद्-ऋतु के बादलों को छिन्न-भिन्न कर देती है’ ॥ २४॥"
इत्यार्षे श्रीमद्रामायणे वाल्मीकीये आदिकाव्ये युद्धकाण्डे द्विषष्टितमः सर्गः॥६२॥ इस प्रकार श्रीवाल्मीकि निर्मित आर्षरामायण आदिकाव्य के युद्धकाण्ड में बासठवाँ सर्ग पूरा हुआ।६२॥,  </main>
Sarga Chapter- 13,Sarga Chapter- 13
॥ श्रीसीतारामचन्द्राभ्यां नमः॥ श्रीमद्वाल्मीकीय रामायण युद्धकाण्डम् त्रयोदशः सर्गः (13),(महापार्श्व का रावण को सीता पर बलात्कार के लिये उकसाना और रावण का शाप के कारण अपने को ऐसा करने में असमर्थ बताना तथा अपने पराक्रम के गीत गाना)
रावणं क्रुद्धमाज्ञाय महापावो महाबलः। मुहूर्तमनुसंचिन्त्य प्राञ्जलिर्वाक्यमब्रवीत्॥१॥,तब रावण को कुपित हुआ जान महाबली महापार्श्व ने दो घड़ी-तक कुछ सोच-विचार करने के बाद हाथ जोड़कर कहा- ॥१॥
यः खल्वपि वनं प्राप्य मृगव्यालनिषेवितम्। न पिबेन्मधु सम्प्राप्य स नरो बालिशो भवेत्॥२॥,"‘जो हिंसक पशुओं और साँसे भरे हुए दुर्गम वन में जाकर वहाँ पीने योग्य मधु पाकर भी उसे पीता नहीं है, वह पुरुष मूर्ख ही है॥२॥"
ईश्वरस्येश्वरः कोऽस्ति तव शत्रुनिबर्हण। रमस्व सह वैदेह्या शत्रूनाक्रम्य मूर्धसु॥३॥,‘शत्रुसूदन महाराज! आप तो स्वयं ही ईश्वर हैं। आपका ईश्वर कौन है? आप शत्रुओं के सिर पर पैर रखकर विदेहकुमारी सीता के साथ रमण कीजिये।३॥
बलात् कुक्कुटवृत्तेन प्रवर्तस्व महाबल। आक्रम्याक्रम्य सीतां वै तां भुक्ष्व च रमस्व च॥४॥,‘महाबली वीर! आप कुक्कुटों के बर्ताव को अपनाकर सीता के साथ बलात्कार कीजिये। बारंबार आक्रमण करके उनके साथ रमण एवं उपभोग कीजिये॥४॥
